{"archival_before":"2026-07-15T00:00:00Z","authorized_tsa_subjects":["CN=AECCTX Test TSA"],"countersignatures":[],"crls":["MIGhMFUCAQEwBQYDK2VwMBsxGTAXBgNVBAMMEEFFQ0NUWCBUZXN0IFJvb3QXDTI2MDcxMzEyMDAwMFoXDTI2MDcxNTEyMDAwMFqgDjAMMAoGA1UdFAQDAgEBMAUGAytlcANBALV7rG6gxwz/CABE7ljJnI5NgDKwy7ZVt+raHislCVtBFIZ3BR27Hk/zMCReNswJ4Vf6XyL7KXGLIeJZjLSsbAc="],"minimum_authorized_signatures":1,"profile":"aecctx-x509-ed25519-crl-time-v1","require_archival_time":false,"required_scopes":["package:approve"],"signers":[{"chain":["MIIBXDCCAQ6gAwIBAgIBAzAFBgMrZXAwGzEZMBcGA1UEAwwQQUVDQ1RYIFRlc3QgUm9vdDAeFw0yNjA1MTUxMjAwMDBaFw0yNjA3MTMxMjAwMDBaMB0xGzAZBgNVBAMMEkFFQ0NUWCBUZXN0IFNpZ25lcjAqMAUGAytlcAMhAGNVaRwXio/5EAenR4r7lV73NSxj57JXA5hM94sm4hpWo3UwczAMBgNVHRMBAf8EAjAAMA4GA1UdDwEB/wQEAwIHgDAdBgNVHQ4EFgQUfDQQbSJ9noj0omuZ/JQ7BObXAxYwHwYDVR0jBBgwFoAUdl/BkSnKd0j+hPuDAQFkMKWXaKMwEwYDVR0lBAwwCgYIKwYBBQUHAwIwBQYDK2VwA0EAMbgdexTzF4LymZ27+EF8J+9mw6B+m5uDL2dP1sQm8AVai48sRH2eWPZWBCfVYN4AkjrDac2F8b9v5+KQWyycCw==","MIIBSjCB/aADAgECAgEBMAUGAytlcDAbMRkwFwYDVQQDDBBBRUNDVFggVGVzdCBSb290MB4XDTI1MDcxNDEyMDAwMFoXDTM2MDcxMTEyMDAwMFowGzEZMBcGA1UEAwwQQUVDQ1RYIFRlc3QgUm9vdDAqMAUGAytlcAMhACASy5DKYOjl2Nr2biJy0iM+BIbVV+jGYUHtiSAXfX63o2YwZDASBgNVHRMBAf8ECDAGAQH/AgEAMA4GA1UdDwEB/wQEAwIBBjAdBgNVHQ4EFgQUdl/BkSnKd0j+hPuDAQFkMKWXaKMwHwYDVR0jBBgwFoAUdl/BkSnKd0j+hPuDAQFkMKWXaKMwBQYDK2VwA0EADbBIVMhzSCvtlDruCnmpEzYndhwbUY2qUmAiL4+GrUKsBpiGs12RxObdE7qrH49mXxxR6ZGMkVRJyPJB4xIdDw=="],"kid":"test-expired","scopes":["package:approve"]}],"timestamp_authorities":[{"chain":["MIIBWTCCAQugAwIBAgIBBTAFBgMrZXAwGzEZMBcGA1UEAwwQQUVDQ1RYIFRlc3QgUm9vdDAeFw0yNjA2MTQxMjAwMDBaFw0yNjA4MTMxMjAwMDBaMBoxGDAWBgNVBAMMD0FFQ0NUWCBUZXN0IFRTQTAqMAUGAytlcAMhAJ9JQ56dsJW8QRHtJdNXldgxvFWgR/Sx1/au43d7tBIgo3UwczAMBgNVHRMBAf8EAjAAMA4GA1UdDwEB/wQEAwIHgDAdBgNVHQ4EFgQU5kLorjynjSHJLXrp01E8Dk5WA/0wHwYDVR0jBBgwFoAUdl/BkSnKd0j+hPuDAQFkMKWXaKMwEwYDVR0lBAwwCgYIKwYBBQUHAwgwBQYDK2VwA0EASyO8Kaf9xBJfDq2TcxWD+DQAnILifZATNpJfStmTSfJkdzT9cLZ6dsZsWomZZobkz9pDn0vv8yUY1D2IaPDyAQ==","MIIBSjCB/aADAgECAgEBMAUGAytlcDAbMRkwFwYDVQQDDBBBRUNDVFggVGVzdCBSb290MB4XDTI1MDcxNDEyMDAwMFoXDTM2MDcxMTEyMDAwMFowGzEZMBcGA1UEAwwQQUVDQ1RYIFRlc3QgUm9vdDAqMAUGAytlcAMhACASy5DKYOjl2Nr2biJy0iM+BIbVV+jGYUHtiSAXfX63o2YwZDASBgNVHRMBAf8ECDAGAQH/AgEAMA4GA1UdDwEB/wQEAwIBBjAdBgNVHQ4EFgQUdl/BkSnKd0j+hPuDAQFkMKWXaKMwHwYDVR0jBBgwFoAUdl/BkSnKd0j+hPuDAQFkMKWXaKMwBQYDK2VwA0EADbBIVMhzSCvtlDruCnmpEzYndhwbUY2qUmAiL4+GrUKsBpiGs12RxObdE7qrH49mXxxR6ZGMkVRJyPJB4xIdDw=="],"kid":"test-tsa"}],"timestamps":[],"trusted_root_sha256":["4157547aae15cb3f582fb18b3c7d19c4a6007bc4f35bab787bbed2b6e73cac4c"],"trusted_subjects":["CN=AECCTX Test Signer"],"verification_time":"2026-07-14T12:00:00Z"}
