{"archival_before":"2026-07-15T00:00:00Z","authorized_tsa_subjects":["CN=AECCTX Test TSA"],"countersignatures":[{"kid":"test-tsa","profile":"aecctx-countersignature-v1","signature":"k7ntbBWOIzVYJKfhZcKZiaYxwp1xOnvFbaRqMEuXFoQSwERSmfg-3K6VzWkd7Iqfw1lPEGTKZXzfpVjrxvRuAg","target_signature_sha256":"80be0e84be270f5eb1c26e756d4e2d9bc27b7188b3dd288b47fa888180678a49"}],"crls":["MIGhMFUCAQEwBQYDK2VwMBsxGTAXBgNVBAMMEEFFQ0NUWCBUZXN0IFJvb3QXDTI2MDcxMzEyMDAwMFoXDTI2MDcxNTEyMDAwMFqgDjAMMAoGA1UdFAQDAgEBMAUGAytlcANBALV7rG6gxwz/CABE7ljJnI5NgDKwy7ZVt+raHislCVtBFIZ3BR27Hk/zMCReNswJ4Vf6XyL7KXGLIeJZjLSsbAc="],"minimum_authorized_signatures":1,"profile":"aecctx-x509-ed25519-crl-time-v1","require_archival_time":true,"required_scopes":["package:approve"],"signers":[{"chain":["MIIBXDCCAQ6gAwIBAgIBAjAFBgMrZXAwGzEZMBcGA1UEAwwQQUVDQ1RYIFRlc3QgUm9vdDAeFw0yNjA2MTQxMjAwMDBaFw0yNjA4MTMxMjAwMDBaMB0xGzAZBgNVBAMMEkFFQ0NUWCBUZXN0IFNpZ25lcjAqMAUGAytlcAMhAPgMzNzkrhwHriCKKt+ZoxCuQgfgMG+gI2EQsGgnu7jQo3UwczAMBgNVHRMBAf8EAjAAMA4GA1UdDwEB/wQEAwIHgDAdBgNVHQ4EFgQU6YqWRh+m7FA+PhVWqLIX9Fscuk0wHwYDVR0jBBgwFoAUdl/BkSnKd0j+hPuDAQFkMKWXaKMwEwYDVR0lBAwwCgYIKwYBBQUHAwIwBQYDK2VwA0EAaoS7OSje1k/HF1AHx98lyJeU+OyB93IDcKreYijHCWMksY8kkkWF1puckij5Ce3lRtsVKObWWKhichaYof3wDA==","MIIBSjCB/aADAgECAgEBMAUGAytlcDAbMRkwFwYDVQQDDBBBRUNDVFggVGVzdCBSb290MB4XDTI1MDcxNDEyMDAwMFoXDTM2MDcxMTEyMDAwMFowGzEZMBcGA1UEAwwQQUVDQ1RYIFRlc3QgUm9vdDAqMAUGAytlcAMhACASy5DKYOjl2Nr2biJy0iM+BIbVV+jGYUHtiSAXfX63o2YwZDASBgNVHRMBAf8ECDAGAQH/AgEAMA4GA1UdDwEB/wQEAwIBBjAdBgNVHQ4EFgQUdl/BkSnKd0j+hPuDAQFkMKWXaKMwHwYDVR0jBBgwFoAUdl/BkSnKd0j+hPuDAQFkMKWXaKMwBQYDK2VwA0EADbBIVMhzSCvtlDruCnmpEzYndhwbUY2qUmAiL4+GrUKsBpiGs12RxObdE7qrH49mXxxR6ZGMkVRJyPJB4xIdDw=="],"kid":"test-signer","scopes":["package:approve"]}],"timestamp_authorities":[{"chain":["MIIBWTCCAQugAwIBAgIBBTAFBgMrZXAwGzEZMBcGA1UEAwwQQUVDQ1RYIFRlc3QgUm9vdDAeFw0yNjA2MTQxMjAwMDBaFw0yNjA4MTMxMjAwMDBaMBoxGDAWBgNVBAMMD0FFQ0NUWCBUZXN0IFRTQTAqMAUGAytlcAMhAJ9JQ56dsJW8QRHtJdNXldgxvFWgR/Sx1/au43d7tBIgo3UwczAMBgNVHRMBAf8EAjAAMA4GA1UdDwEB/wQEAwIHgDAdBgNVHQ4EFgQU5kLorjynjSHJLXrp01E8Dk5WA/0wHwYDVR0jBBgwFoAUdl/BkSnKd0j+hPuDAQFkMKWXaKMwEwYDVR0lBAwwCgYIKwYBBQUHAwgwBQYDK2VwA0EASyO8Kaf9xBJfDq2TcxWD+DQAnILifZATNpJfStmTSfJkdzT9cLZ6dsZsWomZZobkz9pDn0vv8yUY1D2IaPDyAQ==","MIIBSjCB/aADAgECAgEBMAUGAytlcDAbMRkwFwYDVQQDDBBBRUNDVFggVGVzdCBSb290MB4XDTI1MDcxNDEyMDAwMFoXDTM2MDcxMTEyMDAwMFowGzEZMBcGA1UEAwwQQUVDQ1RYIFRlc3QgUm9vdDAqMAUGAytlcAMhACASy5DKYOjl2Nr2biJy0iM+BIbVV+jGYUHtiSAXfX63o2YwZDASBgNVHRMBAf8ECDAGAQH/AgEAMA4GA1UdDwEB/wQEAwIBBjAdBgNVHQ4EFgQUdl/BkSnKd0j+hPuDAQFkMKWXaKMwHwYDVR0jBBgwFoAUdl/BkSnKd0j+hPuDAQFkMKWXaKMwBQYDK2VwA0EADbBIVMhzSCvtlDruCnmpEzYndhwbUY2qUmAiL4+GrUKsBpiGs12RxObdE7qrH49mXxxR6ZGMkVRJyPJB4xIdDw=="],"kid":"test-tsa"}],"timestamps":[{"gen_time":"2026-07-14T11:00:00Z","kid":"test-tsa","profile":"aecctx-trusted-time-v1","signature":"pB_kfbknrrfmxOryGDpcNrcEJYPRuZly1QZN7BibDdKnls9wtE2yRmHF7A-sLw8bkpHQ5PIEf5m0Q5TGmTIPAQ","target_kind":"statement","target_sha256":"3042bd42b2eb5aa03fc05bfd8d829ce407cc4043a0621a04e4b896d351eddd7f","tsa_certificate_sha256":"f4bc9204ab06bdca50f795039d1b2040617bb47262fa1800c47c4541ccd30f37"}],"trusted_root_sha256":["4157547aae15cb3f582fb18b3c7d19c4a6007bc4f35bab787bbed2b6e73cac4c"],"trusted_subjects":["CN=AECCTX Test Signer"],"verification_time":"2026-07-14T12:00:00Z"}
